{
  "$schema": "https://json-schema.org/draft/2020-12/schema",
  "$id": "https://example.com/facebook-ad-creative-input.schema.json",
  "title": "Facebook Ad Creative Skill Input",
  "type": "object",
  "required": ["product_name", "product_category", "product_description"],
  "properties": {
    "product_name": { "type": "string", "minLength": 1 },
    "product_category": { "type": "string", "minLength": 1 },
    "product_description": { "type": "string", "minLength": 1 },
    "key_features": { "type": "array", "items": { "type": "string" }, "default": [] },
    "benefits": { "type": "array", "items": { "type": "string" }, "default": [] },
    "target_audiences": { "type": "array", "items": { "type": "string" }, "default": [] },
    "audience_location": { "type": "string", "default": "United States" },
    "price_positioning": {
      "type": "string",
      "enum": ["budget", "mid-range", "premium", "luxury"],
      "default": "mid-range"
    },
    "brand_tone": { "type": "string", "default": "clear, practical, trustworthy" },
    "visual_style_preference": { "type": "array", "items": { "type": "string" }, "default": [] },
    "banned_elements": { "type": "array", "items": { "type": "string" }, "default": [] },
    "platform": { "type": "string", "enum": ["facebook", "instagram", "meta"], "default": "facebook" },
    "placement": {
      "type": "string",
      "enum": ["feed", "square_feed", "story", "reels", "carousel"],
      "default": "feed"
    },
    "aspect_ratio": { "type": "string", "enum": ["1:1", "4:5", "9:16", "16:9"], "default": "4:5" },
    "language": { "type": "string", "default": "en" },
    "generation_count": { "type": "integer", "minimum": 1, "maximum": 24, "default": 4 },
    "campaign_goal": {
      "type": "string",
      "enum": ["awareness", "traffic", "engagement", "lead", "purchase", "retention"],
      "default": "purchase"
    },
    "awareness_stage": {
      "type": "string",
      "enum": ["cold", "warm", "hot", "mixed"],
      "default": "cold"
    },
    "interests": { "type": "array", "items": { "type": "string" }, "default": [] },
    "scene_preferences": { "type": "array", "items": { "type": "string" }, "default": [] },
    "angle_preferences": { "type": "array", "items": { "type": "string" }, "default": [] },
    "text_overlay_mode": {
      "type": "string",
      "enum": ["none", "light", "standard", "heavy"],
      "default": "light"
    },
    "cta_mode": { "type": "string", "enum": ["none", "soft", "direct"], "default": "soft" },
    "offer_info": { "type": "string", "default": "" },
    "social_proof": { "type": "string", "default": "" },
    "verified_facts": { "type": "array", "items": { "type": "string" }, "default": [] },
    "supplied_specs": { "type": "array", "items": { "type": "string" }, "default": [] },
    "reference_image_visual_facts": { "type": "array", "items": { "type": "string" }, "default": [] },
    "inferred_context": { "type": "array", "items": { "type": "string" }, "default": [] },
    "before_after_evidence": { "type": "array", "items": { "type": "string" }, "default": [] },
    "verified_result_claims": { "type": "array", "items": { "type": "string" }, "default": [] },
    "seasonality": { "type": "string", "default": "" },
    "compliance_notes": { "type": "string", "default": "" },
    "competitor_style_notes": { "type": "string", "default": "" },
    "variation_strength": { "type": "string", "enum": ["low", "medium", "high"], "default": "high" },
    "reference_image": { "type": "string", "default": "" },
    "product_identity_constraints": {
      "type": "array",
      "items": { "type": "string" },
      "default": []
    },
    "creative_layout_intelligence": {
      "type": "object",
      "default": {},
      "properties": {
        "enabled": { "type": "boolean", "default": true },
        "match_level": { "type": "string", "default": "" },
        "sample_count": { "type": "integer", "minimum": 0, "default": 0 },
        "grammar": {
          "type": "object",
          "properties": {
            "layout_families": { "type": "array" },
            "composition_types": { "type": "array" },
            "product_positions": { "type": "array" },
            "product_scale_range": { "type": "array" },
            "headline_positions": { "type": "array" },
            "typography_levels": { "type": "array" },
            "text_density": { "type": "array" },
            "graphic_structure": { "type": "array" },
            "visual_styles": { "type": "array" }
          },
          "additionalProperties": true
        },
        "references": { "type": "array", "maxItems": 3 }
      },
      "additionalProperties": true
    }
  },
  "additionalProperties": true
}
