{
  "product_name": "GlowBarrier Vitamin C Serum",
  "product_category": "beauty skincare",
  "product_description": "A lightweight vitamin C serum for dull skin, uneven tone, and a hydrated daily glow.",
  "key_features": ["10% vitamin C", "hyaluronic acid", "non-sticky texture"],
  "benefits": ["brighter-looking skin", "more even-looking tone", "hydrated finish"],
  "target_audiences": ["busy professionals", "skincare beginners", "ingredient-aware shoppers"],
  "audience_location": "United States",
  "price_positioning": "mid-range",
  "brand_tone": "clean, confident, modern",
  "visual_style_preference": ["minimal ecommerce style", "UGC native realistic style"],
  "banned_elements": ["medical before-after claims", "dermatologist endorsement unless provided"],
  "platform": "facebook",
  "aspect_ratio": "4:5",
  "language": "en",
  "generation_count": 6,
  "campaign_goal": "purchase",
  "awareness_stage": "cold",
  "interests": ["skincare routine", "clean beauty", "self care"],
  "scene_preferences": ["bathroom vanity morning routine", "sunlit bedroom skincare shelf"],
  "angle_preferences": ["Glow-up routine", "Texture proof"],
  "text_overlay_mode": "light",
  "cta_mode": "soft",
  "offer_info": "Free shipping over $35",
  "seasonality": "summer glow",
  "variation_strength": "high"
}
